question,human_answer,eve_lora_rag_answer,eve_rag_answer,llama_rag_answer
What are the impacts of a warming climate on the cryosphere?,"Global warming causes melting of ice on land such as glaciers, and ice sheets in Antarctica and Greenland. This adds water to the ocean, and raises global sea levels. Ice and snow reflect sunlight, cooling the climate, without them, darker land and ocean surfaces absorb heat and amplify climate change. Additionally, thawing permafrost releases significant greenhouse gases, leading to further warming. And human populations living near the sea and in mountain regions will be affected.","\nThe impacts of a warming climate on the cryosphere include a decrease in Arctic sea-ice area, glacier retreat, warming of Arctic fresh waters, warming of Arctic soils and permafrost, and an increase in precipitation and river discharges into the Arctic Ocean.', '","The impacts of a warming climate on the cryosphere include a decrease in Arctic sea-ice area, glacier retreat, rapid warming of Arctic fresh waters, warming of Arctic soils and permafrost, and an increase in precipitation and river discharges into the Arctic Ocean.","I can answer your question based on the provided context. The warming climate has caused notable changes in the Arctic cryosphere, including a decrease in Arctic sea-ice area in all seasons, retreating glaciers, warming of Arctic fresh waters, warming of Arctic soils and permafrost, and an increase in precipitation and river discharges into the Arctic Ocean."
How are earth observations of the cryosphere used practically?,"Earth observations of the cryosphere are utilised to monitor shipping routes and reduce the risk of ships hitting icebergs. They also help to reduce the loss of life and property from natural disasters such as avalanches. Additionally, these observations are used to monitor conditions for tourism and recreation and to help with wildlife management.","\n<|system|>', '","If the number of mentions in Intergovernmental Panel on Climate Change Assessment Reports (IPCC AR) can be used as a proxy to quantify the importance of a component in the climate system, then our understanding of the key role played by the cryosphere can be dated to the mid-2000s. Cryosphere processes and feedback covered just 5 pages in the IPCC Working Group I (WG1) AR3 (IPCC, 2001) but a 48-page dedicated chapter in the IPCC WG1 AR4 (IPCC, 2007).","I can help with that. Based on the context from Document 1, it seems that earth observations of the cryosphere are used to provide data for the Intergovernmental Panel on Climate Change (IPCC) reports."
Why does satellite data play a crucial part for monitoring climate change?,"Satellites are used in conjunction with other data collection tools and methods by scientists to verify models and predictions to help scientists understand, analyse and predict the impact of climate change.","\nSatellites provide a plethora of environmental data, including information on atmospheric composition and surface properties over wide spatial areas, with spatially and temporally delineated coverage based on orbiting patterns and swath width.', '","Satellites provide a plethora of environmental data, including information on atmospheric composition and surface properties over wide spatial areas, and their instruments provide coverage that is spatially and temporally delineated based on orbiting patterns and swath width.",I don't know.
"With Satellite data allowing us to access data about remote regions and on an unprecedented scale, why is it important for scientists to conduct field research?","Satellites are reliable sources of data but they cannot tell us crucial information about what exists under, or in the Earth’s surface","\nTo validate the accuracy of satellite-derived data and to gain a better understanding of the local and regional context.', '","\nTo validate the accuracy of satellite-derived data and to gain a better understanding of the local and regional context that the data can inform.', '",I don't know.
What is the benefit of monitoring the cryosphere using SAR instruments?,SAR instruments are not weather dependent and can penetrate cloud cover,"\nThe benefit is that it can monitor processes across a range of glaciological settings and observable targets, including snow water equivalent, surface/englacial hydrology, storage of water resources, and ice flow.', '","\nThe cryosphere can be monitored using SAR instruments because they can exploit a range of signals to monitor processes across a range of glaciological settings and observable targets.', '","I will look into the documents to find the answer to your question. 

Document 1 mentions that SAR processing methods, including LO-SAR processing, do not provide a range migration, but instead aim to improve the SNR of specular reflections in the radargram. It does not mention the benefits of monitoring the cryosphere using SAR instruments.

Document 2 discusses the use of temporally incoherent radio-astronomical sources for passive radar sounding of glaciers, but it does not mention the benefits of monitoring the cryosphere using SAR instruments.

Document 3 mentions that L-band dry snow and ice dielectric losses are very small, and the L-band radiation may emanate from one to two orders of magnitude deeper than the radiation observed at 6.9 GHz. It also mentions that penetration depth increases as the incidence angle decreases. This document does not mention the benefits of monitoring the cryosphere using SAR instruments.

Unfortunately, I don't have any information about the benefits of monitoring the cryosphere using SAR instruments."
Why is it important for scientists to be able to measure snow on sea ice?,Snow pushes sea ice down and makes taking thickness measurements more difficult,"\nIt is important because snow on sea ice can produce significant SSA, especially in the submicron range, and is on average significantly saltier than snow in inner Antarctica.', '","\nTo understand the physical and chemical properties of snow and sea ice, which can help inform research and policy decisions.', '","I'll answer the question based on the given context. 

The context suggests that it is difficult to measure snow on sea ice, particularly in the Arctic, due to logistical reasons such as harsh weather conditions and the remote location. However, it is crucial to measure snow on sea ice because it affects the salinity of the snow and, in turn, the salinity of the sea ice. The salinity of the snow can be used to calculate the submicron sea salt aerosol (SSA) concentration, which is an important parameter in understanding the Earth's climate system. 

Therefore, the importance of measuring snow on sea ice lies in its impact on the Earth's climate system, particularly in understanding the processes that control the concentration of SSA, which is crucial for predicting climate change."
What is the relationship between multi-year sea ice and climate change?,"Decreasing multi-year ice operates in a negative feedback loop, which accelerates the warming of the planet","\nThe formation of multi-year sea ice is affected by changes in air temperature and ice cover, which in turn affects the Earth\'s climate.', '","\nThe melting of multi-year sea ice is related to climate change, as the ice cover affects the Earth\'s energy balance and the ocean\'s chemistry.', '",I'm ready to answer the question based on the provided context.
Why are satellites important for studying climate change?,Satellites are important for studying climate change because they provide global coverage of measurements and ensure consistency of instrumentation. Satellite data can also be used to validate models and aid in planning for mitigation efforts.,"\nSatellites provide a global perspective on many atmospheric variables, including water vapor, oxygen, carbon monoxide, sulfur dioxide, hydrochloric acid, and others, which is essential for understanding climate change.', '","\nSatellites provide a global perspective on many atmospheric variables, and are increasingly being used to offer a global perspective on many atmospheric variables. They provide coverage that is spatially and temporally delineated based on orbiting patterns and swath width, and are critical for monitoring air quality and human exposure in populated regions around the world.', '",I'll answer your question based on the provided documents.
Why do we need long-term data records?,"We need long term data records to detect trends, decide what is natural variability and what is caused by human impacts, and also to validate models.","\nTo know if change is happening and to distinguish the impact of policy-driven change from shorter-term variability.', '","\nTo know if change is happening and to distinguish the impact of policy-driven change from shorter-term variability.', '",I don't know.
How is large-scale ocean circulation related to weather?,Large-scale ocean circulation is related to weather through the transport of heat and moisture and its influence on winds.,"\nWeather is one of the factors that condition air quality, constraining the atmospheric processes that are associated with the occurrence of pollution episodes.', '","\nWeather is one of the factors that constrain atmospheric processes associated with pollution episodes, including dilution, transformation, transport, and removal of pollutants.', '",I'm ready to answer the question based on the provided context.
What are the four factors that drive ocean circulation?,"Four factors that drive ocean circulation are density, gravity, planetary motion and wind.","\nThe four factors are the downward mixing of heat and associated upwelling across the pycnocline, the wind-driven upwelling of deep waters in the Southern Ocean and their subsequent buoyancy gain at the surface of the ocean, the interplay of winds, eddies, and diapycnal mixing, and the underpinning of the theory that along-isopycnal eddy transport, diapycnal mixing, and wind forcing all determine where dense water returns to the ocean\'s surface.', '","\nThe four factors that drive ocean circulation are the downward mixing of heat and associated upwelling across the pycnocline, the wind-driven upwelling of deep waters in the Southern Ocean and their subsequent buoyancy gain at the surface of the ocean, the eddy transport of oceanic fluids, and diapycnal mixing.', '",I don't know.
Which characteristics of ice allow us to measure it from satellites?,"The characteristics of ice that allow for it to be measured by satellites includes its colour, gravity, surface elevation, surface roughness, and temperature.","\nThe microwave emissivity of a material is affected by its atomic structure, and thus can be used to differentiate between sea and ice from satellite-based sensors.', '","\nThe microwave emissivity of a material is affected by its atomic structure, and thus can be used to differentiate between sea and ice from satellite-based sensors.', '","I'll use the information from the documents to answer the question. The documents mention that the microwave emissivity of a material is affected by its atomic structure, and that this can be used to differentiate between sea and ice from satellite-based sensors. Additionally, the documents mention that passive microwave radiometry sensors onboard satellites have been used to track large icebergs, and that the microwave scatterometer is another satellite-based sensor used for iceberg tracking."
Which characteristics of ice allow us to measure it from satellites?,"The characteristics of ice that allow for it to be measured by satellites includes its colour, gravity, surface elevation, surface roughness, and temperature.","\nThe microwave emissivity of a material is affected by its atomic structure, and thus can be used to differentiate between sea and ice from satellite-based sensors.', '","\nThe microwave emissivity of a material is affected by its atomic structure, and thus can be used to differentiate between sea and ice from satellite-based sensors.', '",I will answer the question using only the context provided.
Why is the rise in sea level not always consistent over the globe?,"The rise in sea level is not always consistent over the globe due to changes in gravity, differences in current dynamics and variations in heating effects.","\nThe rise in sea level is not consistent over the globe because the expansion coefficients of the two layers have different values, with surface waters having bigger thermal expansion coefficients than deeper denser waters.', '","\nThe rise in sea level is not consistent over the globe because the rate of melting varies among different regions.', '",I will answer the question based on the given context.
What tools can we use to predict ocean transport,"To predict ocean transport we can use tools such as hydrodynamic models, altimetry derived currents and theoretical particles or floats to track and simulate ocean movements.","\n<|end|>', '","\nWe can use numerical simulations, data assimilation, and other scientific methods to predict ocean transport.', '",I don't know.
What sort of information can we get about oil spills from satellites?,"The information we can get about oil spills from satellites includes: location, extent, thickness, potential transport and the presence of dispersed oil.",,,"I can help with that. Based on the provided documents, it appears that satellites can be used to identify oil slicks by detecting the dark patterns they produce in SAR (Synthetic Aperture Radar) imagery."
How might satellite data help fisheries be more sustainable?,"Satellite data can help fisheries be more sustainable by indicating where fish nurseries are, so these can be avoided, supporting growth in stocks. It can also help identify where mature fish congregate, reducing fishing effort and increasing efficiency. Additionally it can Indicate areas where top predators congregate, so fishermen can avoid catching them by accident.","\nSatellite data can provide accurate and comprehensive monitoring of light fisheries on the high seas, ensuring better management and sustainability of these vital resources.', '","\nSatellite data can help fisheries be more sustainable by providing accurate and comprehensive monitoring, which can inform better management and sustainability of these vital resources.', '","I can help with that. Based on the provided context, it will provide significant support for the accurate and comprehensive monitoring of light fisheries on the high seas, ensuring better management and sustainability of these vital resources."
How can satellite data help us to conserve biodiversity?,"Satellite data can help us to conserve biodiversity by identifying which species prefer specific habitats, aiding in decision-making for optimal locations of marine reserves, and measuring environmental changes that may impact different species.","\nSatellite data can help us to conserve biodiversity by providing operational methods to improve monitoring of ecosystem conditions and to inform conservation planning and support restoration initiatives.', '","\nSatellite data can help us to conserve biodiversity by providing operational methods for improving monitoring of ecosystem conditions and informing conservation planning and support restoration initiatives.', '","I can help you with that. Based on the context, satellite data can help us to conserve biodiversity by providing a more efficient and cost-effective way to monitor ecosystem conditions and inform conservation planning and support restoration initiatives."
"Other than phytoplankton, where does carbon in the ocean come from?","Carbon in the ocean also comes from rivers, rock weathering and is absorbed directly from the atmosphere.","\nCarbon in the ocean comes from various sources, including respiration of dissolved organic matter, respiration of particulate organic matter, and carbon fixation by cyanobacteria.', '","\nBacteria, which consume pre-formed organic matter, both dissolved and particulate.', '",I'm ready to answer your question.
"As well as salinity, what does the SMOS satellite measure?",The SMOS satellite also measures sea ice thickness and soil moisture.,"\nThe SMOS satellite measures surface soil moisture (SM) over land and sea surface salinity over the oceans.', '","\nThe SMOS satellite measures surface soil moisture and surface salinity over land and sea.', '",I can answer the question based on the given context.
How does the ocean affect weather?,"The ocean affects weather in several ways: sea surface temperature influences land temperatures, evaporation and precipitation. They also play a key role in driving winds and affecting ocean heat content which can impact intensity and formation of tropical storms.","\nThe ocean influences the weather through the transport and dispersion of pollutants, which in turn affects the spatial distribution of O3 and its precursors. Additionally, wind patterns contribute to the transport and dispersion of pollutants, thereby influencing the spatial distribution of O3 and its precursors.', '","\nThe ocean plays a crucial role in changing the marine climate through influences on the top-of-atmosphere and surface energy balance, as well as temperature and cloud profiles. For example, BC over the Arabian Sea has been shown to dim the surface, decrease sea surface temperature, reduce monsoon circulation and vertical wind shear, and consequently increase the intensity of cyclones.', '","I'll do my best to help. Based on the information provided in the documents, it appears that the ocean can affect weather in various ways. For example, it can influence the marine climate, temperature, and cloud profiles, as well as the intensity of cyclones. Additionally, the Pacific Ocean, the largest ocean in the world, can influence the weather and environment in neighboring continents, such as the South Asian and East Asian summer monsoon."
What is needed to validate satellite data on the Greenland Ice Sheet?,"To validate satellite data on the Greenland Ice Sheet, ground-based measurements and continuous research over time are needed.","\nIn situ observations', '","\nComparison with in situ observations is needed to validate satellite data on the Greenland Ice Sheet.', '","I can answer your question based on the provided context. 

From the provided documents, I see that Hall et al. (2008) mentions a comparison of satellite-derived and in situ observations of ice and snow surface temperatures over Greenland. This suggests that in situ observations are necessary to validate satellite data on the Greenland Ice Sheet."
"What has caused the Greenland Ice Sheet to advance at a rate of 90cm each day, over the last few summers?",Meltwater penetrating under the ice and acting as a lubricant,"\nThe Greenland Ice Sheet has been advancing at a rate of 90cm each day, over the last few summers, due to meltwater supply variability.', '","\nThe Greenland Ice Sheet has been advancing at a rate of 90cm each day, over the last few summers, due to the melting of surface water.', '",I don't know.
"To estimate carbon emissions from burnt vegetation, we need to know the burnt area combined with what other information?",The proportion of vegetation that actually burns,"\nThe burnt area combined with fuel loading, combustion completeness, and emission factor for BC.', '","\nFuel loading, combustion completeness, and emission factor for BC.', '","I will try to find the information you need to answer the question from the documents. 

Based on the information from the documents, to estimate carbon emissions from burnt vegetation, we need to know the burnt area combined with the emission factor."
What has caused the Greenland Ice Sheet to advance at a rate of 90cm each day over the last few summers?,Meltwater penetrating under the ice and acting as a lubricant,"\nThe reason is unknown, as stated in the passage, and the data are generally restricted to the winter months.', '","\nThe exact cause is not specified in the passage, but it is mentioned that the ice sheet has been advancing rapidly over the last few summers.', '",I don't know.
What are the main challenges of using satellite data to observe inland waters?,"The main challenges of using satellite data to observe inland waters are obtaining suitable spatial resolution, observing differences between bright (land) and dark (water) targets, and distinguishing between different types of constituents in the water.","\nThe main challenges include uncertainties in the AC for inland water, the presence of anomalous pixels due to clouds, shadows, sun glints, and small ships, and discrepancies between daily averaged field measurements and instantaneous satellite values.', '","\nThe main challenges include uncertainties in the AC for inland water, the presence of anomalous pixels due to clouds, shadows, sun glints, and small ships, and discrepancies between daily averaged field measurements and instantaneous satellite values.', '","I'll look at the documents to answer your question. Based on the information provided, the main challenges of using satellite data to observe inland waters include uncertainties in the AC (atmospheric correction) for inland water, the presence of anomalous pixels due to clouds, shadows, sun glints, and small ships, and discrepancies between daily averaged field measurements and instantaneous satellite values."
How does optical EO identify specific gas species in the atmosphere?,By the reflective colour of gases,"\nThe optical EO identifies specific gas species by measuring the absorption of electromagnetic radiation at different wavelengths, and using knowledge of the characteristic spectral fingerprints of the gases.', '","\nUsing knowledge of their characteristic spectral fingerprints, optical EO separates the extinction signal into a low-frequency and a high-frequency part, with the low-frequency part being treated as a closure term and fitted by a low-order polynomial.', '","I'll do my best to help you with that! Based on the context, I can see that the documents discuss various methods for retrieving atmospheric trace gases from infrared remote-sensing instruments. Document 2 mentions the DOAS (Differential Optical Absorption Spectroscopy) method, which uses the Beer and Lambert law to describe the attenuation of electromagnetic radiation in a medium. The law is used to separate the extinction signal into a low-frequency and a high-frequency part, where the low-frequency part is treated as a closure term and is fitted by a low-order polynomial. This is done to identify the characteristic spectral fingerprints of trace gases of interest."
What are the two main obstacles to finding usable optical EO data of a location in the immediate aftermath of a disaster?,"Revisit time of satellites over the area, and cloud cover","\nThe two main obstacles are the lack of suitable imagery and the slow processing time of EO data.', '","\nThe two main obstacles are that suitable imagery is often not collected until more than 1 month after the disaster, and complete inventories containing polygon data take a longer time to create.', '",I don't know.
What changes in soil properties can we identify using Earth observation data?,Colour,"\nDepth is a strong predictor of soil properties, indicating a strong correlation between soil properties and sample depth.', '","\nChanges in soil properties such as pH, nutrient content, and soil erosion can be identified using Earth observation data.', '",I can answer your question.
What is the minimum repeat visit time required for monitoring crop health?,A few days,"\n3 days.', '","\nThe minimum repeat visit time required for monitoring crop health is 3 days.', '",I don't know.
What other EO technologies can be used alongside optical for monitoring agriculture?,SAR (synthetic aperture radar),"\nComputer Vision with Deep Learning for Plant Phenotyping in Agriculture: A Survey', '","\nComputer Vision with Deep Learning for Plant Phenotyping in Agriculture: A Survey', '","I'll do my best to help you with that. Given the context, it seems like the answer is related to the text about satellites and their applications in agriculture. Based on that, I would say that radar sensors can be used alongside optical sensors for monitoring agriculture."
What is the main cause of changes in ocean colour in coastal zones?,Pollution from waste water,"\nThe presence of colored organic materials such as CDOM, phytoplankton, and total suspended solids (TSS) in coastal zones causes changes in ocean color.', '","\nThe presence of colored organic materials, such as CDOM, which absorbs light and affects the temperature of the water.', '",I'm ready to answer the question based on the given context.
What is the main limiting factor affecting the sensitivity of optical sensors to longer wavelengths?,The materials from which the sensor is made,"\nThe detection energy threshold of a detector governs the maximum wavelength of an absorbed photon that will result in a detection being registered.', '","\nThe main limiting factor affecting the sensitivity of optical sensors to longer wavelengths is the detection energy threshold of the sensor, which governs the maximum wavelength of an absorbed photon that will result in a detection being registered.', '",I don't know.
How do scientists evaluate the accuracy of ECVs?,Scientists evaluate the accuracy of ECVs by comparing them to independent field measurements and to model simulation results.,"\nThe accuracy of ECVs is evaluated through statistical parameters such as MSE, RMSE, MAE, PSNR, and correlation.', '","\nThe accuracy of ECVs is evaluated qualitatively or semi-quantitatively, and the model accuracy directly influences the ability of decision-makers to set up intervention measures correctly.', '",I'm ready to answer the question based on the provided context.
