question,human_answer,eve_lora_rag_answer,eve_rag_answer,llama_rag_answer
What technique do satellites use to identify and measure different trace gases?,Spectroscopy,"\nSatellites use a technique called\'scanning through\' the atmospheric limb, collecting emission spectra from discrete molecular line transitions as a function of altitude and position, and separating out the spectral line signatures from each specific altitude within the beam path.', '","\nSatellites use satellite-based microwave sensing to identify and measure different trace gases. This involves scanning the Earth\'s limb and collecting the emission spectra from discrete molecular line transitions as a function of altitude and position.', '",I will provide the answer based solely on the given documents.
"In the atmospheric sciences, what are radiative transfer models (RTMs) used for?","To calculate radiative forcing for greenhouse gases, aerosols, or clouds","\nRTMs are used to describe the complex interactions of scattering and absorption of radiation with the constituents of the atmosphere, water, vegetation, and soils.', '","\nRTMs are used to describe the complex interactions of scattering and absorption of radiation with the constituents of the atmosphere, water, vegetation, and soils.', '","I can answer your question based on the provided context. Radiative transfer models (RTMs) are used to describe the complex interactions of scattering and absorption of radiation with the constituents of the atmosphere, water, vegetation, and soils."
"What is calculated in and around an atmospheric model's ""grid box""?","Chemistry, aerosol distribution, and wind","\nThe surface grid may be a latitude-longitude grid or more complicated, for example an icosahedral grid. For the sake of simplicity, we will consider latitude-longitude grids.', '","\nThe grid box contains a single grid cell of an NWP model, which treats the whole model domain as a single grid cell. Sub-grid variations of relevant variables are obtained directly from the 40,000 grid points of 100 × 100 m dimensions, which together form the modeled area.', '","I'll answer the question based on the provided context. 

From Document n. 1, it is mentioned that the surface grid may be a latitude-longitude grid φj,λk or more complicated, for example an icosahedral grid φjk,λjk. For the sake of simplicity, we will consider latitude-longitude grids. 

From Document n. 2, it is mentioned that the whole model domain of 20,000 × 20,000 m is treated as a single grid cell of an NWP model, and sub-grid variations of the relevant variables are obtained directly from the 40,000 grid points of 100 × 100 m dimensions.

From Document n. 3, it is mentioned that Locations at the coarse-grid level or the fine-scale subgrid are referred to as GRID and SUB, respectively.

Based on the provided context, it appears that in and around an atmospheric model's ""grid box,"" the following are calculated:

* The gridded field of refractivity nijk = n(zijk, φj, λk) related to geometrical grids of altitudes zijk, latitudes φj, and longitudes λk.
* The surface pressure Psjk at the surface grid with indexes j, k.
* The gridded temperature Tijk.
* The gridded specific humidity qijk with index i enumerating the vertical levels.
* The surface related parameter qz0, which is obtained from the equation qz0 = (Chzq/αt)(qa + qs)/((Chz0/αt) + 1), where αt = 2.1 × 10−5, and Chzq, zq, qs, and z0 are parameters related to moisture roughness length, moisture, and other variables.
* The sub-grid variations of the relevant variables, which are obtained directly from the grid points of 100 × 100 m dimensions.

Therefore, the answer to the question is that various atmospheric variables and parameters are calculated in and around an atmospheric model's ""grid box."""
"What is the name given to data derived from current and historical satellite instruments and in-situ instruments, combined with computer models?",Reanalysis data,"\nSpatial Data Infrastructure', '","\nSpatial Data Infrastructure', '",I don't know.
How is TROPOMI used to support policy making?,By providing accurate and useable data about atmospheric composition in a range of gases in specified local and global areas,"\nTROPOMI is used to support policy making by providing publicly available satellite retrievals and data portals for emission monitoring and air quality assessments.', '","\nTROPOMI is used to support policy making by providing publicly available satellite retrievals and data that can inform decisions.', '",I don't know.
What is the name of the effect when light changes colour due to a change in the wave frequency?,Doppler Shift,"\nThe name of the effect is dispersion.', '","\nThe name of the effect is dispersion.', '",I will provide the question and you will answer it based on the provided context.
Why are in situ measurements used as well as satellite measurements?,In situ observations provide quality control on the combined information from models and satellite observations.,"\nIn situ measurements are used to capture spatial heterogeneity, as there are large spatial scale differences between in situ-satellite based measurements.', '","\nTo capture spatial heterogeneity and ensure that the difference between the median or mean in situ value and the satellite value is minimized.', '",I will answer the question based on the provided context.
How does the Infrared Spectrometer instrument work?,The instrument sends out a beam of light which is then absorbed and reflected by the molecules in the smoke. These absorptions create a frequency that acts as a fingerprint to identify various compounds in the smoke.,"\nThe instrument observes a wide spectral interval ranging from 4.15 μm to 14.6 μm with high spectral resolution, and each spectrum comprises of the order of 50 000 spectral elements.', '","\nThe instrument observes a wide spectral interval ranging from 4.15 μm to 14.6 μm with high spectral resolution, and each spectrum comprises of the order of 50,000 spectral elements, providing rich information for analysis.', '",I'm ready to answer your question based on the given documents.
What are the challenges that make using AI and Earth monitoring different from other computer vision problems?,"The challenges of using AI for Earth observation (EO) compared to other computer vision problems include the scarcity of training datasets that are time-consuming to create, the difficulty of combining different types of EO datasets, and the complexity of geo-locating data to fuse it with other sources.","\nThe challenges include the fact that Earth observation images are taken from an overhead perspective, usually from a fixed distance from the Earth\'s surface, and have a temporal axis that is sometimes irregular or regular, with cloud coverage causing spurious occlusions.', '","\nThe challenges include the fact that Earth observation images are taken from an overhead rather than ground perspective, usually from a fixed distance from the Earth\'s surface, and the satellite revisits provide a temporal axis that is sometimes irregular or regular with cloud coverage causing spurious occlusions.', '",I'm ready to answer the question based on the provided context.
What makes Sentinel-3 level 4 products different from levels 1-3?,They include in situ and model data,"\nThe Sentinel-3 level 4 products are obtained by calibration and processing of the level 0 product, which is further divided into Single Look Complex (SLC) and Ground Range Detected (GRD) products.', '","\nThe Sentinel-3 level 4 products are further processed from the level 1 products, which consist of calibrated and processed level 0 products. The level 4 products are used for scientific purposes and are not suitable for remote sensing applications.', '",I don't know.
How can we measure sea-level rise from satellites?,Using satellite Altimeters,"\nThe passage does not explicitly state how to measure sea-level rise from satellites, but it mentions that satellites can be used to measure sea levels.', '","\nWe can measure sea-level rise from satellites by using altimetry, which provides absolute sea levels with respect to Earth\'s center of mass, and tide gauges, which provide relative sea levels with respect to the datum.', '",I will answer the question based on the given documents.
What type of Marine debris is detected by Satellites and is important to identify to avoid at-sea accidents?,"The type of marine debris that can be detected by satellites and is important to identify to avoid at-sea accidents, are drift wood from flooding, and plastics.","\nLarge-area automatic detection of shoreline stranded marine debris using deep learning', '","\nThe passage describes the detection of floating marine debris from satellites, which is important to identify to avoid at-sea accidents.', '",I'm ready to answer the question based on the provided context.
Why can cloud classification be challenging to complete with data from satellites?,"Cloud classification can be challenging to complete with data from satellites, because satellite Passive instruments cannot measure cloud depth, which is needed for some cloud classification types, and satellite Active sensors can only give us a narrow swath of data, which is not good enough for global cloud classification.","\nThe passage does not explicitly state why cloud classification can be challenging, but it mentions that machine learning methods such as RF and SVM focus on classifying individual pixels and require input features that are arbitrary.', '","\nBecause cloud discovery algorithms may need to be re-engineered or replicated to meet processing and delivery time requirements.', '","I can answer your question based on the provided context. 

The text mentions that cloud classification can be challenging because current methods have three major drawbacks. However, it does not specify what those drawbacks are."
What ice type is classified from SAR polarimetric data as bright regions with strong back scatter?,Rough first year ice,"\nFYI (First-year ice)', '","\nFYI (First-Year Ice)', '",I don't know.
Why was it a challenge to use satellite data (from OCO-2 and GOSAT) to obtain information on COVID-19 related CO2 emission reductions?,Because these satellites have been optimised to obtain information on large scale terrestrial biosphere carbon fluxes.,"\nThe number of overpasses producing local images with low cloud cover is limited each year, even with a CO2M constellation of three or more satellites.', '","\nThe number of overpasses producing local images with low cloud cover is limited each year, even with a CO2M constellation of three or more satellites, and this limits the estimation of annual budgets or their anomalies.', '",I'm ready to answer the question based on the provided context.
Why is Sentinel-1’s Radar instrument useful for monitoring mangroves?,"Sentinel-1’s Radar instrument is useful for monitoring mangroves because it can measure through clouds to show the canopy of the mangroves, and it provides data in the visible spectrum, as well as near-infrared and shortwave infrared.","\n<|system|>\n<|end|>', '","\nThe passage does not explicitly state why Sentinel-1’s Radar instrument is useful for monitoring mangroves, but it mentions that it is used in previous studies for deep semantic segmentation of mangroves.', '",I don't know.