User Type,Question,Answer,Source [1],[2],[3],[4]
Student,Can you explain the difference between passive and active remote sensing?,"Active sensors generate their own energy to illuminate the objects they observe. They emit radiation towards the target and then measure the radiation that is reflected or backscattered back to the sensor. This allows active sensors to operate independently of external light sources. In contrast, passive sensors detect natural energy, such as sunlight, that is emitted or reflected by the objects or scenes they observe. The most common source of radiation for passive sensors is reflected sunlight, which they measure to gather information about the target.",NASA – Remote Sensing ,,,
Student,Summarise the abstract of the paper - Ecosystem Services Supply from Peri-Urban Watersheds in Greece: Soil Conservation and Water Retention,"The study investigates ecosystem service (ES) supply in peri-urban watersheds (PUWs) across Greece using earth observation (EO) data and empirical models. Utilising various geospatial datasets within a GIS environment, the research focuses on assessing soil conservation and water retention services at the watershed scale. Findings indicate that soil conservation services range from 44.41 to 441.33 tons per hectare per year (t ha−1 y−1), averaging 161.99 t ha−1 y−1, while water retention services vary from 35.09 to 154.63 millimeters (mm), averaging 91.45 mm across PUWs. The study highlights elevation-dependent variations, with higher soil conservation values in alpine and subalpine areas, and greater water retention in mountainous and semi-mountainous regions. Different ecosystem types within PUWs, such as woodland, forest, heathland, and shrubs, exhibit varying levels of ES provision. These insights contribute to sustainable land management strategies and inform policy decisions aimed at preserving ecosystem health and resilience.",https://www.mdpi.com/2073-445X/13/6/765,,,
Student,How does satellite data contribute to understanding and monitoring climate change impacts on global ecosystems?,"Satellite data is essential for monitoring and comprehending the impacts of climate change on global ecosystems by providing timely, precise, and consistent data on Earth's surface, oceans, and atmosphere across different spatial and temporal scales. This data is instrumental in advancing our understanding of the climate system and developing strategies for climate mitigation. Agencies such as NASA, NOAA, and ESA utilize satellite data to monitor various environmental indicators including greenhouse gas concentrations in the atmosphere, weather patterns, vegetation health, glacier and polar ice melt, coral reef bleaching, ocean acidification, shifts in wildlife migration patterns, and more.",How Satellites Help Tackle Climate Change ,,,
Student,Why is accurate monitoring of snow water equivalent (SWE) important and what are some of its implications?,"Accurate monitoring of snow water equivalent (SWE) is crucial because snow plays a vital role in the global water cycle, providing water to over 20% of the world’s population and impacting flora, fauna, and climate regulation. Changes in snow patterns due to global warming affect water management, agriculture, winter tourism, and environmental stability, prompting societal shifts in snow-dependent communities. Remote sensing, particularly through methods like passive microwave inversion algorithms and artificial intelligence (AI) approaches such as Random Forest (RF) and neural networks (NN), plays a key role in providing essential data for scientific understanding and societal planning in these areas.",Snow Water Equivalent Monitoring—A Review of Large-Scale Remote Sensing Applications,,,
Student,Where can I download Sentinel-1 SAR data?,"Sentinel-1 SAR data can be downloaded from the Copernicus Browser. It is available for download in three acquisition modes, these being Stripmap (SM), Extra Wide Swath (EW) and Interferometric Wide Swath (IW) modes.  There are also four polarization options, which determine with which polarisation the data was acquired. These are single polarisation HH (SH) or VV (SV) or in dual polarisation HH&HV (DH) or VV&VH (DV), depending on the instrument mode. SM, IW and EW can be acquired in single or dual polarisation. WV can only be acquired in single polarisation.",Copernicus Browser,,,
Student,What are the challenges and limitations of Earth observation technologies?,"Earth observation technologies face several challenges and limitations. One major challenge is the management and processing of the massive volumes of data generated, which requires significant computational resources and advanced analytical methods​ [1]​. Additionally, there are issues related to data quality and accuracy, such as sensor calibration errors and atmospheric interferences that can degrade the data quality​ [2]​. Another limitation is the temporal and spatial resolution of the sensors; while some satellites offer high spatial resolution, they might not provide frequent temporal updates, and vice versa. Moreover, the integration of data from multiple sources can be complex due to differences in sensor characteristics and data formats. Furthermore, the application of machine learning and AI in processing this data introduces biases and uncertainties that need careful management to ensure reliable results​ [3]​​ [4]​. These challenges necessitate ongoing advancements in technology, methodology, and international cooperation to fully leverage the potential of Earth observation data.","Challenges and Solutions for Utilizing Earth Observations in the ""Big Data"" era",Deep Learning and Earth Observation to Support the Sustainable Development Goals,Responsible AI for Earth Observation,"Explainable AI for Earth Observation: Current Methods, Open Challenges, and Opportunities"
Student,How do satellites contribute to Earth observation?,"Satellites continually orbit the globe, collecting information about Earth’s Ocean, atmosphere, and land surfaces. Satellites can even monitor the activity of life forms, such as phytoplankton, from their remote vantage points. Satellite imagery provides the greatest benefit to the most people when it can be analysed by anyone with an interest. [1] They use cutting-edge space technologies to learn more about the interactions between the atmosphere, biosphere, hydrosphere, cryosphere and Earth’s interior, essential to understand how Earth works as a system. Importantly, they address scientific questions that help predict the effects of climate change and address scientific questions that have a direct bearing on societal issues that humankind is likely to face in the coming decades. [2]",Welcome to NASA Earth Observations (NEO)ESA - Earth observation,,,
Student,Can you explain the different layers of the atmosphere ,"Earth's atmosphere is divided into several layers based on temperature: the troposphere, stratosphere, mesosphere, thermosphere, and exosphere. The troposphere, the lowest layer in direct contact with Earth's surface, contains about 80% of the atmosphere's total mass, where most weather phenomena occur and temperature decreases with altitude, extending from 8 to 14.5 km altitude, higher at the equator than at the poles. The stratosphere, holding around 19% of the atmospheric mass and extending to around 50 km, contains the ozone layer and has increasing temperatures with altitude due to ozone absorbing UV radiation. Above the stratosphere, the mesosphere extends to around 80 km, where temperatures decrease with height, and noctilucent clouds form. The thermosphere, extending to around 700 km, is free of clouds and water vapor, with increasing temperatures due to absorption of solar UV and X-ray radiation, and is where most polar orbiting satellites are found. Beyond the thermosphere, the exosphere contains widely separated particles of hydrogen and helium, effectively blending into outer space.",EO from Space: The Atmosphere MOOC,,,
Student,Summarise this article’s introduction: https://www.mdpi.com/2077-0472/14/6/837,"Grasslands are vital for ecosystem services like climate regulation, carbon sequestration, and biodiversity, and play a key role in global food security. In Poland, grasslands cover 12% of the land, supporting livestock feed, biodiversity, and microclimate regulation. Climate change impacts these ecosystems, highlighting the need for sustainable management and accurate monitoring.
Satellite data, such as ERA5-Land, aids in tracking climate conditions affecting grasslands. Effective management requires understanding ecosystem dynamics and utilizing remote sensing technologies to monitor plant growth and productivity, enhancing precision agriculture.
Crop growth simulation models like AquaCrop, developed by FAO, optimize crop water productivity. Initially for food crops, AquaCrop now includes modules for forage crops. In Poland, combining AquaCrop with Sentinel-2 satellite data has improved grassland management, promoting sustainability and productivity in regions like Podlasie and Wielkopolska.","Assessment of Grassland Biomass Prediction Using AquaCrop Model: Integrating Sentinel-2 Data and Ground Measurements in Wielkopolska and Podlasie Regions, Poland",,,
Student,What are the applications of lidar in remote sensing?,"Lidar has several remote sensing applications including in agriculture, forestry and conservation, geology, atmosphere, mining, disaster monitoring and more. Terrestrial lidar data is most commonly represented in topographic models known as Digital Elevation Models (DEMs). Satellite lidar systems benefit from rapid revisit periods and multiple passes over the same area, creating remote sensing applications in agriculture, forestry and conservation. Atmospheric lidars provide information on properties such as particle altitude, optical properties, wind speed and direction, and atmospheric gas concentrations.[1] Spaceborne lidar data can also derive metrics like canopy height, stem diameter and density, which together are predictive of biomass. [2]", Lidar (Light detection and ranging),Above-Ground Biomass,,
Policy Maker,How can Earth observation data be used to improve urban planning and infrastructure development?,"Earth observation is a vital tool for facilitating the sustainable development of the world's cities, helping to ensure that urban centres keep spurring collaboration, innovation and opportunity as they continue to expand. High-resolution satellite imagery helps identify and map existing infrastructure, such as roads, bridges, and buildings. This information is crucial for planning new infrastructure projects, maintaining existing assets, and optimising transportation networks. EO data can also assess the impact of construction activities and monitor the condition of infrastructure over time​.",How satellite data empower sustainable urban growth,How EU Space helps protect – even restore – Europe’s forests,,
Policy Maker,How can Earth observation technologies be leveraged to monitor and enforce environmental regulations?,"Earth observation technologies, such as satellites, drones, and remote sensing, play a crucial role in monitoring and enforcing environmental regulations. These technologies provide high-resolution, real-time data that helps track deforestation, illegal logging, and land-use changes, as seen with Brazil's use of satellites to monitor the Amazon rainforest. [1] They also aid in water quality management by detecting pollutants and algal blooms, with systems like the European Space Agency’s Sentinel-3 satellite, which has very high temporal resolution, monitoring ocean and inland water quality. [2] Additionally, they help measure atmospheric pollutants to monitor air quality, leveraging data from sources like NASA's Aura satellite.[3]",Global Green Up Slows Warming,The Use of Sentinel-3/OLCI for Monitoring the Water Quality and Optical Water Types in the Largest Portuguese Reservoir,About Aura ,
Policy Maker,How can EO support sustainable agriculture? ,"To achieve the global increase in food and agriculture commodity supply in a sustainable manner governments and development agencies must improve agricultural sector diagnostics, development indicators, programme monitoring, and service delivery to accomplish this. This necessitates access to unbiased quantified information at a large-scale. Because of advancements in satellite technology, such as data obtained from Copernicus, the European Union's Earth Observation (EO) programme, this is becoming increasingly available. Combining EO data with sophisticated analytics, information, and other support tools enables decision-makers and policymakers to make more informed decisions because they now have data at previously unavailable scales, resolution, and frequencies",Space for IDA MOOC,,,
Policy Maker,How does Copernicus contribute to monitoring and supporting a sustainable blue economy?,"Copernicus contributes to monitoring and supporting a sustainable blue economy by providing comprehensive data and analysis through its Sentinel satellites and in situ observations. This includes tracking sea surface temperature, sea level, ocean colour, and marine litter, which informs policy makers on the health and abundance of marine ecosystems and the impacts of human activities. Additionally, Copernicus supports responsible management of fish stocks, identifies critical areas for biodiversity conservation, and enhances coastal resilience against climate change. By promoting pollution reduction and recycling efforts, Copernicus helps drive the transition towards a circular economy in maritime sectors, aligning with the EU's Green Deal ambitions.",Space-Based Solutions for the Blue Economy,,,
Policy Maker,How can EO data help with environmental monitoring in areas experiencing conflict?,"Copernicus contributes to monitoring and supporting a sustainable blue economy by providing comprehensive data and analysis through its Sentinel satellites and in situ observations. This includes tracking sea surface temperature, sea level, ocean colour, and marine litter, which informs policy makers on the health and abundance of marine ecosystems and the impacts of human activities. Additionally, Copernicus supports responsible management of fish stocks, identifies critical areas for biodiversity conservation, and enhances coastal resilience against climate change. By promoting pollution reduction and recycling efforts, Copernicus helps drive the transition towards a circular economy in maritime sectors, aligning with the EU's Green Deal ambitions.",Space-Based Solutions for the Blue Economy,,,
Policy maker,How can satellite remote sensing contribute to global energy security and assessment?,"Satellite sensing contributes to global energy security and assessment by providing data on renewable energy potential, monitoring current energy infrastructure, and tracking oil production and transportation. It can also assess energy systems affected by natural disasters or conflicts, enhancing understanding and response capabilities[1]. Remote sensing data is also enhancing the renewable energy landscape, offering valuable insights to overcome critical knowledge gaps. By measuring solar radiation, wind speeds, and other atmospheric parameters, Earth Observation (EO) satellites provide essential data to evaluate the potential of renewable energy resources at specific locations. [2].",Satellite Data Offers a Broad Array of Policy Insights,Earth Observation and Clean Energy,,
Policy Maker,How can EO be utilised to help with water scarcity?,"EO technology can be utilised for surface water monitoring, aiding in efficient planning and decision-making for issues like drought mitigation. It provides data for monitoring rainfall, soil moisture, vegetation, evapotranspiration, land surface temperature, flood frequency, water extent, water quality, land cover, tree cover percentage, and tree cover loss. EO can also map and monitor irrigation extent to enhance water efficiency, offering regular updates on in-season water use. This allows for the adjustment of irrigation schedules and water distribution, providing valuable insights to improve water management.",Water Scarcity,,,
Policy Maker,How can EO support forestry management?,"EO provides benefits within forestry in many overarching areas including by supporting mapping and monitoring of deforestation and forest degradation, supporting precision forestry,  providing resilience to natural disasters such as fires and floods in forests, and aiding local forest populations. [1]. EO can also be used to monitor forest carbon stocks by mapping and monitoring forest biomass to estimate its potential to serve as a carbon sink. [2]EO is the only cost-effective solution, providing global, comprehensive, accurate, repeatable and timely, and is invaluable in the planning and implementation of Forestry Management activities.[2]",Adoption and Impact of Earth Observation for the 2030 Agenda for Sustainable Development,How EU Space helps protect – even restore – Europe’s forests,Learn more about EO4SD-Forest Management,
Policy Maker,Where can I find high quality air pollution data to support policy and decision making in Europe?,"High quality data on air pollution is provided by the Copernicus Atmosphere Monitoring Service (CAMS). CAMS policy support provides a number of products and results that aim at supporting decision and policy making in the management of air pollution episodes and reporting under European Directives. Policy services are based on the air quality regional services capacities to elaborate added value products describing the evolution of air quality in Europe and the influence of the main anthropogenic sources, helping in designing appropriate and efficient policy responses to episode situations.",CAMS Policy Support,,,
Policy Maker,"What is spatial resolution in satellite imagery, and how does it affect the level of detail and applications for Earth Observation (EO) products?","The spatial resolution of an image refers to the level of detail that can be retrieved from a scene, measured by the Ground Sample Distance (GSD), which is the distance between adjacent pixel centres on the ground. A lower GSD indicates finer detail. Spatial resolution is categorised as follows: low resolution images have a GSD larger than 300 m. medium resolution is between 300 m and 30 m, high resolution from 30 to 5 m and very high resolution (VHR) below 5 m.",ESA Newcomers Earth Observation Guide,,,
EO Expert,What are the latest advancements in Machine Learning algorithms for satellite image classification? ,"Cutting-edge classification algorithms include Artificial Neural Networks (ANNs), Classification Trees (CTs), and Support Vector Machines (SVMs) [1]. Additionally, semi-supervised and unsupervised learning methods, such as self-supervised learning, are being developed to leverage vast amounts of unlabelled satellite data, improving model robustness and reducing the reliance on labelled data [2]",Evaluating Satellite Image Classification: Exploring Methods and Techniques ,wav2vec 2.0: A Framework for Self-Supervised Learning of Speech Representations,,
Eo Expert,What are the steps to setting up a Machine Learning Workflow for analysing EO data? ,"Setting up a Machine Learning (ML) workflow for analysing Earth Observation (EO) data involves several steps.
1) You first need to clearly define the problem you are trying to solve.
2) Next, select the appropriate data and choose the correct learning algorithm for your specific problem.
3) The most crucial part of machine learning is preparing your training data set. This involves cleaning the data, handling missing values, and possibly transforming features to better suit the algorithm you have chosen. Once your data is prepared, you can proceed to train your model.
4) After training, it's essential to evaluate the performance of your model. This is done by testing it on a portion of the training data that you set aside before starting the learning process. This reserved data, often called the validation set, helps you assess how well your model generalises to new, unseen data.
5) If the results are satisfactory and the model performs well, your problem is effectively solved! However, if the performance is not up to par, you may need to optimise your model. This could involve adjusting parameters, tuning hyperparameters, or even selecting different algorithms. You can then re-train and re-evaluate your model as needed until you achieve the desired outcome.",AI for Earth Monitoring MOOC,,,
Eo Expert,What are the typical performance metrics in the SAR-RST-FLOOD approach used to evaluate automated approaches for mapping flooded areas?,"The typical performance metrics in the SAR-RST-FLOOD approach used to evaluate automated approaches for mapping flooded areas include overall accuracy (OA), user accuracy (UA), producer accuracy (PA), and the Kappa index (K). These metrics are employed to assess the reliability, accuracy, and agreement of the SAR-based automated flood mapping methodology against reference flood maps or datasets.",A Synthetic Aperture Radar-Based Robust Satellite Technique (RST) for Timely Mapping of Floods,,,
Eo Expert,"What is MODTRAN6 radiative transfer (RT) code, and how has it improved from earlier versions of MODTRAN?","MODTRAN (MODerate resolution atmospheric TRANsmission) is a computer program designed to model atmospheric propagation of electromagnetic radiation for the 100-50,000 cm−1 (0.2 to 100 μm) spectral range. This covers the spectrum from middle ultraviolet to visible light to far infrared. [1] MODTRAN6 represents a significant leap forward from earlier versions of the MODTRAN atmospheric transmittance and radiance model. This updated version incorporates modern software architecture, including an application programming interface (API), enhanced physics capabilities such as a line-by-line algorithm, an expanded physics toolkit, and updated documentation. The API is designed for seamless integration into diverse user applications. The restructuring of MODTRAN towards a modular, object-oriented architecture aims to streamline updates and foster interoperability with third-party codes. Additionally, MODTRAN now supports high-resolution radiative transfer calculations through its line-by-line algorithm and integrates with optical scattering models, enabling straightforward customization for aerosols and clouds. [2]",MODTRAN ,MODTRAN® 6: A major upgrade of the MODTRAN® radiative transfer code,,
EO Expert,"What are the primary advantages of combining Artificial Intelligence with satellite remote sensing for Land Cover Change Detection, and can you provide an example?","Integrating AI with Satellite Remote Sensing in LCCD offers several significant benefits. Firstly, AI accelerates research efforts by aiding in hypothesis generation and experiment design. It allows for efficient interpretation of large datasets, providing insights that surpass traditional methods. Secondly, AI enhances the accuracy of mapping land cover patterns at various scales—global, regional, and local—critical for monitoring our dynamic environment. This integration plays a pivotal role in detecting land cover changes swiftly and accurately, which in turn influences ecological balance, aids in climate change mitigation strategies, and guides sustainable urban development. Thus, the collaboration between AI and satellite remote sensing proves invaluable in advancing scientific discovery and practical applications in environmental monitoring and management. [1] VITO Remote Sensing developed a deep neural network algorithm for detecting land cover changes using satellite imagery. This algorithm, based on Tile2Vec and trained on 500,000 image patches from Copernicus Sentinel-2 and Planet Fusion data, extracts compressed image features. It distinguishes between seasonal changes (like foliage colour variations) and structural changes (such as deforestation from fires), improving the accuracy of land cover change detection. The algorithm effectively ignores natural seasonal effects, making it robust for monitoring and managing land cover changes on a large scale [2].",The Use of Artificial Intelligence and Satellite Remote Sensing in Land Cover Change Detection: Review and Perspectives,The Use of Artificial Intelligence and Satellite Remote Sensing in Land Cover Change Detection: Review and Perspectives,Revealing hidden land patterns with AI and Copernicus,
EO Expert,How has satellite data helped detect climate-change-driven trends in phytoplankton populations over the past two decades?,"Satellite data, specifically from the Moderate Resolution Imaging Spectroradiometer (MODIS) aboard the Aqua satellite, has revealed significant trends in ocean colour (remote-sensing reflectance, Rrs) over a 20-year period. These trends indicate that low-latitude oceans have become greener, suggesting shifts in phytoplankton populations and surface-ocean ecosystems driven by climate change. This analysis highlights the utility of satellite observations in detecting rapid climate-change signals in marine environments.",Global climate-change trends detected in indicators of ocean ecology,,,
